CREATE TABLE Student(
    s_id int primary key,
    Drive_id int,
    T_id int,
    s_name varchar(20) not null,
    CGPA DECIMAL(3,2) CHECK (CGPA >= 0.0 AND CGPA <= 10.0),
    s_branch varchar(20) not null,
    s_dob date not null,
    foreign key (Drive_id) references PlacementDrive(Drive_id),
    foreign key (T_id) references Training(T_id)
    ON DELETE cascade
    ON UPDATE cascade
);

CREATE TABLE PlacementDrive(
    Drive_id int primary key,
    Pcompany_name varchar(50) not null,
    package varchar(10) not null,
    P_location varchar(10) not null
);

CREATE TABLE Training(
    T_id int primary key,
    Tcompany_name varchar(20) not null,
    T_Fee float not null,
    T_year year not null

);

-- Insert at least 10 records in the Student table and insert other tables accordingly.
INSERT INTO PlacementDrive (Drive_id, Pcompany_name, package, P_location) VALUES
(1, 'TCS', '30000', 'Pune'),
(2, 'Infosys', '40000', 'Mumbai'),
(3, 'Wipro', '50000', 'Delhi'),
(4, 'Capgemini', '35000', 'Pune'),
(5, 'Cognizant', '45000', 'Hyderabad');

INSERT INTO Training (T_id, Tcompany_name, T_Fee, T_year) VALUES
(101, 'QSpiders', 25000, 2019),
(102, 'JSpiders', 27000, 2020),
(103, 'NareshIT', 30000, 2021),
(104, 'ABC Training', 28000, 2018),
(105, 'DEF Training', 26000, 2019),
(106, 'PQR Tech', 31000, 2021),
(107, 'LMN Academy', 24000, 2019);

INSERT INTO Student (s_id, Drive_id, T_id, s_name, CGPA, s_branch, s_dob) VALUES
(1, 1, 101, 'Amit', 8.5, 'Computer', '2001-01-01'),
(2, 2, 102, 'Deepa', 7.8, 'IT', '2000-05-12'),
(3, 3, 103, 'Ankit', 9.2, 'Computer', '2002-07-19'),
(4, 4, 104, 'Divya', 6.9, 'Mechanical', '1999-12-31'),
(5, 5, 105, 'Aarav', 7.5, 'IT', '2001-04-25'),
(6, 1, 106, 'Bhavya', 8.7, 'Electronics', '2000-11-11'),
(7, 2, 107, 'David', 9.0, 'Computer', '2001-02-14'),
(8, 3, 103, 'Sneha', 6.5, 'Civil', '2000-03-03'),
(9, 4, 101, 'Aditya', 7.0, 'IT', '2002-08-08'),
(10, 5, 105, 'Rohit', 9.8, 'Computer', '2001-06-06');

Query OK, 10 rows affected (0.10 sec)
Records: 10  Duplicates: 0  Warnings: 0

-- Display all students details with branch ‘Computer ‘and ‘It’ and student name starting with ‘a' or 'd'.
mysql> select * from Student where s_branch in('Computer', 'IT') and s_name LIKE 'a%' OR s_name LIKE 's%';
+------+----------+------+--------+------+----------+------------+
| s_id | Drive_id | T_id | s_name | CGPA | s_branch | s_dob      |
+------+----------+------+--------+------+----------+------------+
|    1 |        1 |  101 | Amit   | 8.50 | Computer | 2001-01-01 |
|    3 |        3 |  103 | Ankit  | 9.20 | Computer | 2002-07-19 |
|    5 |        5 |  105 | Aarav  | 7.50 | IT       | 2001-04-25 |
|    8 |        3 |  103 | Sneha  | 6.50 | Civil    | 2000-03-03 |
|    9 |        4 |  101 | Aditya | 7.00 | IT       | 2002-08-08 |
+------+----------+------+--------+------+----------+------------+
5 rows in set (0.00 sec)

-- list the number of different companies. (use of distinct)
mysql>  select distinct Pcompany_name from PlacementDrive;
+---------------+
| Pcompany_name |
+---------------+
| TCS           |
| Infosys       |
| Wipro         |
| Capgemini     |
| Cognizant     |
+---------------+
5 rows in set (0.01 sec)

 
mysql>  Select T_Fee,T_year from Training where T_year = '2019';
+-------+--------+
| T_Fee | T_year |
+-------+--------+
| 28750 |   2019 |
| 29900 |   2019 |
| 27600 |   2019 |
+-------+--------+
3 rows in set (0.00 sec)

-- Give 15% increase in fee of the Training whose joining year is 2019.

mysql>  UPDATE Training set T_Fee = T_Fee + T_Fee*0.15 where T_year = '2019';
Query OK, 3 rows affected (0.03 sec)
Rows matched: 3  Changed: 3  Warnings: 0

mysql>  Select T_Fee,T_year from Training where T_year = '2019';
+---------+--------+
| T_Fee   | T_year |
+---------+--------+
| 33062.5 |   2019 |
|   34385 |   2019 |
|   31740 |   2019 |
+---------+--------+
3 rows in set (0.01 sec)

-- Delete Student details having CGPA score less than 7.

mysql>  select s_name, CGPA from Student where CGPA < 7.0;
+--------+------+
| s_name | CGPA |
+--------+------+
| Divya  | 6.90 |
| Sneha  | 6.50 |
+--------+------+

mysql>  DELETE from Student Where CGPA < 7.0;
Query OK, 2 rows affected (0.03 sec)
Rows matched: 2  Changed: 2  Warnings: 0

mysql>  select s_name, CGPA from Student;
+--------+------+
| s_name | CGPA |
+--------+------+
| Amit   | 8.50 |
| Deepa  | 7.80 |
| Ankit  | 9.20 |
| Aarav  | 7.50 |
| Bhavya | 8.70 |
| David  | 9.00 |
| Aditya | 7.00 |
| Rohit  | 9.80 |
+--------+------+
8 rows in set (0.00 sec)

-- Find the names of companies belonging to Pune or Mumbai
mysql>  select Pcompany_name, P_location from PlacementDrive where P_location in('Pune', 'Mumbai');
+---------------+------------+
| Pcompany_name | P_location |
+---------------+------------+
| TCS           | Pune       |
| Infosys       | Mumbai     |
| Capgemini     | Pune       |
+---------------+------------+
3 rows in set (0.00 sec)

-- Find the student’s name who joined training in 1-1-2019 as well as in 1-1-2021
mysql> select Student.s_name, Training.T_year from  Student, Training where Student.T_id = Training.T_id and T_year in ('2019', '2021');
+--------+--------+
| s_name | T_year |
+--------+--------+
| Amit   |   2019 |
| Ankit  |   2021 |
| Aarav  |   2019 |
| Bhavya |   2021 |
| David  |   2019 |
| Aditya |   2019 |
| Rohit  |   2019 |
+--------+--------+
7 rows in set (0.06 sec)

-- Find the student’s name having maximum CGPA score and names of students having CGPA score between 7 to 9.

-- Display all Student name with T_id with decreasing order of Fees
mysql> select Student.s_name, Training.T_Fee from  Student, Training where Student.T_id = Training.T_id order by Training.T_Fee desc;
+--------+---------+
| s_name | T_Fee   |
+--------+---------+
| Aarav  |   34385 |
| Rohit  |   34385 |
| Aditya | 33062.5 |
| Amit   | 33062.5 |
| David  |   31740 |
| Bhavya |   31000 |
| Ankit  |   30000 |
| Deepa  |   27000 |
+--------+---------+
8 rows in set (0.00 sec)


-- Display Pcompany_name, S_name, location and Package with Package 30K, 40K and 50k
mysql> select PlacementDrive.Pcompany_name, Student.s_name, PlacementDrive.package, PlacementDrive.P_location from  Student, PlacementDrive where Student.Drive_id = PlacementDrive.Drive_id and PlacementDrive.package in (30000, 40000, 50000);
+---------------+--------+---------+------------+
| Pcompany_name | s_name | package | P_location |
+---------------+--------+---------+------------+
| TCS           | Amit   | 30000   | Pune       |
| Infosys       | Deepa  | 40000   | Mumbai     |
| Wipro         | Ankit  | 50000   | Delhi      |
| TCS           | Bhavya | 30000   | Pune       |
| Infosys       | David  | 40000   | Mumbai     |
+---------------+--------+---------+------------+
5 rows in set (0.00 sec)




